<?xml version="1.0" encoding="UTF-8"?>
<!DOCTYPE syllabus SYSTEM "primjer4.dtd">
<syllabus>
    <class>
        <name>Web arhitekture</name>
        <teacher>dr. Muhamed Begović</teacher>
        <demonstrator>Nedim Kujrakovic</demonstrator>
        <schedule>
            <day>Monday</day>
            <time>10:00</time>
        </schedule>
    </class>
    <class>
        <name>Baze podataka</name>
        <teacher>doc. dr. Adnan Dželilhodžić</teacher>
        <schedule>
            <day>Monday</day>
            <time>17:00</time>
        </schedule>
    </class>
    <class>
        <name>Softversko inžinjerstvo II</name>
        <teacher>doc. dr. Adnan Dželilhodžić</teacher>
        <schedule>
            <day>Wednesday</day>
            <time>17:00</time>
        </schedule>
    </class>
</syllabus>